PLACE_OF_RESIDENCE(e1,e2)	<e1> I </e1> then moved to Maryland where I taught for 1 year before moving to <e2> Colorado </e2>.
DATE_OF_BIRTH(e2,e1)	Finbar Patrick McGuigan MBE (born  <e2> 28 February 1961 </e2> ), known as Barry McGuigan and nicknamed <e1> The Clones Cyclone </e1>, is a retired Irish professional boxer from Clones, County Monaghan, Ireland who became a World Boxing Association featherweight champion.
PLACE_OF_BIRTH(e1,e2)	Bokuzen Hidari (<e1> 左 卜全 </e1> Hidari Bokuzen, 20 February 1894 - 26 May 1971) was a Japanese actor and comedian born in Kotesashi Village (now part of <e2> Tokorozawa </e2>), Iruma District, Saitama Prefecture, Japan.
DATE_OF_BIRTH(e1,e2)	<e1> Hanin Elias </e1> (born <e2> 31 May 1972 </e2>) is a German industrial/techno artist.
EMPLOYEE_OR_MEMBER_OF(e2,e1)	At  <e2> St. John's </e2> , <e1> Mr. </e1> Zeppieri was a Senior Board Member of the Moot Court where he participated in a National Moot Court competition.
EMPLOYEE_OR_MEMBER_OF(e1,e2)	<e1> I </e1> also previously worked as an assistant trust officer with Citigroup Trust Delaware, N.A. before joining <e2> RBC Wealth Management </e2>.
DATE_OF_BIRTH(e1,e2)	<e1> John Floyer </e1> (<e2> 26 April 1811 </e2> – 4 July 1887) was an English cricketer with amateur status who was active from 1832 to 1833.
PLACE_OF_BIRTH(e2,e1)	Born and raised in  <e2> Singapore </e2> , <e1> Chef </e1> Elvin Chew was lured into the culinary world when his aspiration to be a chef kicked in at a tender age of 16.
PLACE_OF_BIRTH(e2,e1)	The Pacifica,  <e2> California </e2>  native made <e1> his </e1> first forays into show business when he took on the position of personal manager for his younger brother, comedian and actor Rob Schneider, and subsequently managed the San Francisco area rock band Head On.
PLACE_OF_RESIDENCE(e2,e1)	Crombac shared an apartment in  <e2> Paris </e2>  with <e1> racer </e1> Jim Clark when Clark officially lived in Switzerland for tax reasons.
EMPLOYEE_OR_MEMBER_OF(e1,e2)	Previously, <e1> I </e1> worked with National Bank of Kuwait for 23 years where i was the Group General Manager of the <e2> International Banking Group </e2> in charge of the bank's international activities, branches and subsidiaries worldwide.
EDUCATED_AT(e1,e2)	<e1> Claire </e1> is a graduate of the <e2> University of Ottawa Faculty of Law </e2>, where she received the Robert Pitfield Entrance Scholarship, stood on the Dean’s Honour List in first year and was a finalist in the 2014 Hicks Morley Labour Law Moot.
PLACE_OF_BIRTH(e2,e1)	 <e2> Kuwait </e2>  Invest for Medical Services: a story of struggle and success <e1> Nabil Yusuf Al Abdulla </e1> or as he likes to be called ‘’Abu Ahmed ’’, born in Kuwait to a middl...e class family.
PLACE_OF_BIRTH(e1,e2)	<e1> Steven A. Davis </e1> was born at Bergstrom AFB in <e2> Austin </e2>, TX in November 1956.
DATE_OF_BIRTH(e1,e2)	<e1> Marios Garoyian </e1> (Greek: Μάριος Καρογιάν; Armenian: Մարիոս Կարոյեան; born <e2> 31 May 1961 </e2>) is a Cypriot-Armenian politician.
PLACE_OF_BIRTH(e2,e1)	Nootcharin Sukkhongdumnoen (Thai: นุชจรินทร์ สุขคงดำเนิน; born February 10, 1978 in  <e2> Bangkok </e2> ) is a Thai taekwondo practitioner, <e1> who </e1> competed in the women's featherweight category.
PLACE_OF_BIRTH(e1,e2)	<e1> I </e1> was born and raised in Paradise <e2> California </e2>, and educated through the Paradise School System.
DATE_OF_BIRTH(e1,e2)	<e1> Amado Rigoberto Morales </e1> (born <e2> July 22, 1947 </e2>) is a retired male javelin thrower from Puerto Rico, who competed for his native country during the 1970s and the 1980s.
EDUCATED_AT(e1,e2)	<e1> Myers </e1> served for 18 years on the Graduate School faculty at <e2> Penn State </e2> in Penn State’s nationally recognized Smeal College of Business.
EMPLOYEE_OR_MEMBER_OF(e1,e2)	<e1> He </e1> was a retired Air Force Veteran and later worked for the <e2> City of West Allis </e2> as a Civil Engineer.
PLACE_OF_BIRTH(e1,e2)	<e1> Colette </e1> Rolland (born 1943, in Dieupentale, Tarn-et-Garonne, <e2> France </e2>) is a French computer scientist and Professor of Computer Science in the department of Mathematics and Informatics at the University of Paris 1 Pantheon-Sorbonne, and a leading researcher in the area of information and knowledge systems, known for her work on meta-modeling, particularly goal modelling and situational method engineering.
EDUCATED_AT(e1,e2)	<e1> Murray </e1> has an MBA from <e2> Harvard Business School </e2> and an A.B. degree in mathematics and economics from Ohio Wesleyan University.
NATIONALITY(e1,e2)	<e1> Olav Terje Bergo </e1> (born 8 October 1946) is a <e2> Norwegian </e2> former newspaper editor.
PLACE_OF_BIRTH(e1,e2)	<e1> William (Billy) Franklin Trausti Davidson </e1> was born July 30, 1945 in <e2> Winnipeg </e2> the son of Víglundur Franklin Davidsson - W. F. (Bill) Davidson and Thorbjörg (Bobbi) Davidson (nee Solmundson).
PLACE_OF_BIRTH(e1,e2)	<e1> Peter </e1> (1946-2012) was originally from <e2> Brooklyn </e2> and an accomplished musician (mandolin, guitar, etc.).
EDUCATED_AT(e1,e2)	<e1> Patrick </e1> William Rooke is the current Bishop of Tuam, Killala, and Achonry.Born on 12 April 1955, he was educated at Sandford Park School and Salisbury and <e2> Wells Theological College </e2>; and ordained in 1979.
PLACE_OF_BIRTH(e1,e2)	<e1> David Civera Gracia </e1> (born in Teruel, <e2> Aragón </e2>, Spain on 8 January 1979) is a Spanish singer.
EMPLOYEE_OR_MEMBER_OF(e2,e1)	Kathy Hamrick serves as Vice-President of  <e2> Commemorative Arts </e2>  with <e1> Mike Hamrick </e1> as consulting Architect.
PLACE_OF_BIRTH(e1,e2)	<e1> Barry Lee Myers </e1> is a native of Philadelphia, <e2> PA </e2>.
DATE_OF_BIRTH(e1,e2)	<e1> John Nolan </e1> (born <e2> 22 May 1938 </e2>) is a British film and television actor, known for his role as a Wayne Enterprises board member Douglas Fredericks in Batman Begins, The Dark Knight and The Dark Knight Rises promotional segments Gotham Central.
EMPLOYEE_OR_MEMBER_OF(e2,e1)	Prior to joining  <e2> BrightTag </e2> , <e1> Eric </e1> was co-founder and CTO of FeedBurner, which Google acquired in 2007.
EDUCATED_AT(e1,e2)	<e1> I </e1> am currently a student at <e2> Fordham University </e2> who is pursuing a career in the field of business.
EMPLOYEE_OR_MEMBER_OF(e1,e2)	<e1> He </e1> worked for almost fifteen years at the Central University of Venezuela and the <e2> Simón Bolívar University </e2>.
PLACE_OF_BIRTH(e2,e1)	William Welles Hollister (1818–1886) was a native of  <e2> Ohio </e2>  <e1> who </e1> came west in the 1850s and became a wealthy rancher and entrepreneur in California.
PLACE_OF_BIRTH(e1,e2)	<e1> Evan Thomas </e1> was born on February 17, 1891 in Vancouver, British Columbia, <e2> Canada </e2> as Elystan Owen Evan Thomas.
EDUCATED_AT(e1,e2)	<e1> David Ostrowski </e1> (born 1981 in Cologne) is a German painter.He studied at <e2> Kunstakademie Düsseldorf </e2> with Albert Oehlen.
NATIONALITY(e1,e2)	<e1> Alfredo Rocco </e1> (born 9 September 1875 in Naples – died 28 August 1935) was an <e2> Italian </e2> politician and jurist.
DATE_OF_BIRTH(e1,e2)	<e1> Ronnie Brunswijk </e1> (born <e2> March 7, 1961 </e2>) is a Surinamese ex-rebel leader, politician, business man, football player and convict.
EMPLOYEE_OR_MEMBER_OF(e1,e2)	Prior to joining EEDC, Ms. <e1> Nwankwo </e1> worked for the Nigeria Government owned <e2> National Electricity Company </e2> (PHCN).
PLACE_OF_RESIDENCE(e1,e2)	Upon graduating first in the class of 2005, Dr. Berard and <e1> his </e1> family moved to <e2> Holland </e2> in 2007 -- taking over as owners of their own practice in 2010.
PLACE_OF_RESIDENCE(e1,e2)	I've lived here most of <e1> my </e1> life, moved here from San Jose <e2> California </e2> in 1983 with my parents when they purchased Stormy Point Campground & Resort.
DATE_OF_BIRTH(e1,e2)	<e1> Geoffrey Ronald (Geoff) Craige </e1> (born <e2> 20 May 1943 </e2>) is an Australian politician.
PLACE_OF_BIRTH(e1,e2)	<e1> Piet Goethals </e1> (born in <e2> Ghent </e2>, Belgium) is a master of History of Art and Art Philosophy and a bachelor in Dutch and English literature and language.
EMPLOYEE_OR_MEMBER_OF(e1,e2)	<e1> He </e1> currently serves on boards for SPS Commerce (Chairman), <e2> Piper Jaffray </e2>, Hutchinson Technology, HelpSystems, Soran Foundation, and a trustee for the University of Minnesota Foundation.
EDUCATED_AT(e1,e2)	<e1> He </e1> received his baccalaureate from the <e2> University of Georgia </e2>, and pursued doctoral studies at the London School of Economics.
PLACE_OF_BIRTH(e1,e2)	<e1> Jody John Schulz </e1> (born August 17, 1960 in Easton, <e2> Maryland </e2>) is a former American football linebacker who played for five seasons for the Philadelphia Eagles of the National Football League from 1983–1987.
PLACE_OF_RESIDENCE(e1,e2)	<e1> Alvares </e1> is married to Claude Alvares, a known environmental activist and the couple lives in <e2> Parra </e2>, Goa with their three children, Rahul, Samir and Milind.
PLACE_OF_BIRTH(e1,e2)	<e1> He </e1> was born in <e2> Ormskirk </e2>, Lancashire, England in 1808 and studied at Trinity College, Cambridge.
NATIONALITY(e1,e2)	"<e1> Everett John ""Sonny"" Grandelius </e1> (April 16, 1929 – April 25, 2008) was an <e2> American </e2> football player, coach, announcer, and executive."
EDUCATED_AT(e2,e1)	Since Fall 2013, I have been pursuing an MBA & MIS dual degree at the  <e2> University of Nebraska </e2> , Omaha, USA (AACSB Accredited), in order to develop <e1> my </e1> marketing and technology skills further.
EDUCATED_AT(e1,e2)	<e1> Barclay </e1> was born at Hurkisgarth, in Sandwick, on the Mainland of Orkney, and educated at <e2> Oxtro School </e2>, in Birsay, George Heriot's School, in Edinburgh, and Edinburgh University (BSc; PhD 1947).
EMPLOYEE_OR_MEMBER_OF(e2,e1)	"In its simplest form, Bell's theorem states:  <e2> Cornell </e2>  solid-state physicist <e1> David Mermin </e1> has described the appraisals of the importance of Bell's theorem in the physics community as ranging from ""indifference"" to ""wild extravagance""."
DATE_OF_BIRTH(e1,e2)	<e1> Louis Andriessen </e1> ([luˈi ˈɑndrisə(n)]; born <e2> 6 June 1939 </e2>) is a Dutch composer and pianist based in Amsterdam.
EMPLOYEE_OR_MEMBER_OF(e2,e1)	For most of his life Baudouin de Courtenay worked at Imperial Russian universities: Kazan (1874–1883),  <e2> Dorpat </e2>  (as Tartu, Estonia was then known) (1883–1893), Kraków (1893–1899) in Austria-Hungary, and St. Petersburg (1900–1918), where he was known as Иван Александрович Бодуэн де Куртенэ (<e1> Ivan Aleksandrovich Boduen de Kurtene </e1>), and in Russia he is recognized as a Russian scientist.
NATIONALITY(e1,e2)	Bassem I. Awadallah (Arabic: ب<e1> اسم عوض الله </e1>; born in 1964) is a <e2> Jordanian </e2> public figure.
EMPLOYEE_OR_MEMBER_OF(e1,e2)	<e1> Andrzej Kajetan Wróblewski </e1> (Polish pronunciation: Vrooblevski, born 1933 in Warsaw) – Polish physicist, ordinary professor doctor habilitatus (since 1971), dean of the <e2> Physics Department Warsaw University </e2> (1986–1989), Rector of the Warsaw University (1989–1993), President of the Academic Council of the Institute for the History of Science, Polish Academy of Sciences.
PLACE_OF_RESIDENCE(e1,e2)	Born in Polish Republic, raised in the Soviet Union, immigrant to Israel, <e1> Shanin </e1> made his career in the <e2> United Kingdom </e2> until he went to Russia to found the Moscow School of Social and Economic Sciences.
PLACE_OF_RESIDENCE(e1,e2)	Because his father was employed by the United States Army, <e1> Frank </e1> lived in Japan, Nevada, California, New York, <e2> Texas </e2>, North Carolina, and Hawaii during his childhood.
EDUCATED_AT(e1,e2)	Over the next few years <e1> I </e1> studied at Grant Macewan, NSCAD University, and The <e2> Cooper Union </e2>, and began a freelance practice working for clients in the music and cultural sectors.
PLACE_OF_RESIDENCE(e2,e1)	She recently moved from Madison and  <e2> Wabash </e2>  to this location, so you may already know <e1> her </e1>.
NATIONALITY(e1,e2)	<e1> Mark Garrow </e1> (born April 2, 1955; died at approximately 9:30 a.m on October 19, 2007) was an <e2> American </e2> and former Prior General of the Congregation of Marian Fathers.
NATIONALITY(e1,e2)	<e1> Tom Hubert </e1> (born May 24, 1977) is a <e2> Belgian </e2> engineer, inventor and investor.
EMPLOYEE_OR_MEMBER_OF(e1,e2)	<e1> He </e1> has long been interested and involved in the educational needs of inner-city children and served as a director of the Chicago-area <e2> YMCA </e2>, where he also volunteered his time with the “Off the Street Club.”
DATE_OF_BIRTH(e2,e1)	Eugene Paul Nassar ( <e2> 20 June 1935 </e2>  - 7 April 2017), was Professor of English Emeritus of Utica College, Utica, New York, the author of several books of literary criticism in the close analysis tradition of his teachers, John Crowe Ransom <e1> at </e1> Kenyon College, Christopher Ricks at Oxford University, Arthur Mizener of Cornell University, and his critical model and mentor, Cleanth Brooks.
NATIONALITY(e1,e2)	<e1> Jean Serge Essous </e1> (born 1935 Brazzaville - died November 25, 2009 in Brazzaville) was a <e2> Congolese </e2> saxophonist, clarinetist, and cofounder of the Afrika Team in Paris, France, the band Bantous de la Capital in Brazzaville, Congo, OK Jazz, and Orchestre Rock a Mambo.
PLACE_OF_RESIDENCE(e1,e2)	<e1> I </e1> have lived in <e2> W Melbourne </e2> since 2004 and hope to continue for many more years.
EMPLOYEE_OR_MEMBER_OF(e1,e2)	Saul Bellow wrote Ravelstein, a roman à clef based on <e1> Bloom </e1>, his friend and colleague at the <e2> University of Chicago </e2>.
EMPLOYEE_OR_MEMBER_OF(e1,e2)	The importance of loop gain as a parameter for characterizing electronic feedback amplifiers was first recognized by Heinrich Barkhausen in 1921,was developed further by Hendrik Wade Bode and <e1> Harry Nyquist </e1> at <e2> Bell Labs </e2> in the 1930s.
PLACE_OF_BIRTH(e1,e2)	<e1> Nora Lustig </e1> (born January 13, 1951 in Buenos Aires, <e2> Argentina </e2>) is the Samuel Z. Stone Professor of Latin American Economics in the Department of Economics at Tulane University and a non-resident Fellow at the Center for Global Development and the Inter-American Dialogue.
PLACE_OF_BIRTH(e1,e2)	Radivoje Brajović (Serbian Cyrillic: <e1> Радивоје Брајовић </e1>) (born 11 January 1935 in <e2> Peć </e2>, Kingdom of Yugoslavia) was the President of the Presidency of the Socialist Republic of Montenegro from May 1986 to May 1988 and the President of its Executive Council in 1982-1986.
PLACE_OF_BIRTH(e1,e2)	<e1> He </e1> manages the Cole Land Transportation Museum, the Walking Sticks for Veterans program, and organizes numerous activities and charity drives for veterans and related causes in his native <e2> Bangor </e2>, Maine.
PLACE_OF_BIRTH(e2,e1)	In May 2005,  <e2> Denver </e2>  native and long time Trouts customer <e1> Tucker Ladd </e1> came in and purchased Trouts Fly Fishing just before the shop was about to shutter it's doors.
DATE_OF_BIRTH(e1,e2)	<e1> Gildo Pallanca Pastor </e1> (born <e2> 1 April 1967 </e2>) is a Monegasque businessman, CEO and owner of Venturi Automobiles.
EDUCATED_AT(e1,e2)	Over the next few years <e1> I </e1> studied at <e2> Grant Macewan </e2>, NSCAD University, and The Cooper Union, and began a freelance practice working for clients in the music and cultural sectors.
DATE_OF_BIRTH(e2,e1)	Marie Helvin (born  <e2> August 13, 1952 </e2> , Tokyo, Japan) is a British-based American fashion model, who worked extensively with David Bailey—to whom <e1> she </e1> was married between 1975 and 1985.
PLACE_OF_BIRTH(e1,e2)	<e1> Jan Eugeniusz Krysiński </e1> (born 17 August 1935 in <e2> Warsaw </e2>) is a Polish scientist, specializing in fluid mechanics and turbomachinery research, and former rector of Lodz University of Technology.
EMPLOYEE_OR_MEMBER_OF(e1,e2)	Following a post-doctoral year at Copenhagen University with Herman Kalckar and Ole Maaloe, later <e1> Watson </e1> worked at the University of Cambridge's Cavendish Laboratory in England, <e2> where </e2> he first met his future collaborator and friend Francis Crick.
EMPLOYEE_OR_MEMBER_OF(e1,e2)	<e1> Peter Stephen Kalikow </e1> (born December 1, 1942) is President of <e2> H. J. Kalikow & Company, LLC </e2>, one of New York City's leading real estate firms.
PLACE_OF_BIRTH(e1,e2)	Mr Gibbs retired, but the Dandy brothers (<e1> who </e1> originally hailed from <e2> Peterborough </e2>) maintained the local connection by naming the newly-acquired business Gibbs & Dandy.
PLACE_OF_RESIDENCE(e1,e2)	<e1> She </e1> lived in Winnipeg, <e2> Manitoba </e2> before settling in Toronto with her writer/filmmaker/publisher husband Clive Holden.
EMPLOYEE_OR_MEMBER_OF(e1,e2)	<e1> Makhosazana </e1>'s career began when she worked for the <e2> Truwoths Group </e2>, as an Assistant Store Trainee Manager.
EMPLOYEE_OR_MEMBER_OF(e1,e2)	<e1> I </e1>n 2007 I got my Real Estate licence and after much consideration joined <e2> Coldwell Banker Trinity Realty Brokerage </e2> located in Wasaga Beach and Collingwood.
PLACE_OF_BIRTH(e1,e2)	<e1> Ritu Gyamdan Tamang </e1> is a native from from the Langtang Region, the most popular trekking area of <e2> Nepal </e2>.
EDUCATED_AT(e1,e2)	<e1> Lewis </e1> studied at Queens' College, Cambridge between 1964 and 1967 <e2> where </e2> he was a member of the Cherubs dining society.
EDUCATED_AT(e1,e2)	<e1> I </e1> am currently a student at the Smith School of Business at the <e2> University of Maryland </e2> and am planning on double majoring in Accounting and Finance.
EMPLOYEE_OR_MEMBER_OF(e2,e1)	 <e2> Liverpool </e2>  established itself as a major force in both English and European football during the 1970s and '80s when Bill Shankly and <e1> Bob Paisley </e1> led the club to 11 League titles and seven European trophies.
EDUCATED_AT(e1,e2)	Since Fall 2013, <e1> I </e1> have been pursuing an MBA & MIS dual degree at the <e2> University of Nebraska </e2>, Omaha, USA (AACSB Accredited), in order to develop my marketing and technology skills further.
EMPLOYEE_OR_MEMBER_OF(e1,e2)	<e1> He </e1> is the Chairman of the Malaysian Accounting Standards Board (MASB), Council Member of MICPA, First Chairman of the Asian-Oceanian Standard Setters Group (AOSSG) 2009/2010, Chairman of <e2> AOSSG Working Group on Islamic Finance </e2>, Member of the AAOIFI (Middle East Islamic Standards Setter) Accounting and Auditing Standards Board based in Bahrain and an Advisory Board Member to the Faculty of Business & Accountancy University Malaya.
NATIONALITY(e1,e2)	<e1> Francis Charles Turner </e1> (born June 2, 1951) is a <e2> Canadian </e2> actor and iconographer born in Wainwright, Alberta and now living in BC.
PLACE_OF_RESIDENCE(e1,e2)	Having gained an extensive experience in brewing under <e1> his </e1> father, he emigrated to <e2> Montreal </e2> from Scotland in about 1818.
EMPLOYEE_OR_MEMBER_OF(e1,e2)	<e1> Milnor </e1> is a distinguished professor at <e2> Stony Brook University </e2> and one of the four mathematicians to have won the Fields Medal, the Wolf Prize, and the Abel Prize (along with Pierre Deligne, Jean-Pierre Serre, and John G. Thompson).
DATE_OF_BIRTH(e1,e2)	<e1> Cornelia Maria Clapp </e1> (<e2> March 17, 1849 </e2> – December 31, 1934) was an American zoologist and academic specializing in marine biology.
PLACE_OF_BIRTH(e1,e2)	<e1> Maia Damianovic </e1> (born in <e2> England </e2>), grew up in the United States.
EDUCATED_AT(e1,e2)	<e1> He </e1> was born in Italy and educated in the UK where he earned his Mechanical Engineering degree from <e2> Newcastle University </e2>.
DATE_OF_BIRTH(e1,e2)	<e1> Eric John Sever </e1> (born <e2> 1 April 1943 </e2>) is a former Labour Party politician in England.
EDUCATED_AT(e1,e2)	<e1> I </e1> am a proponent of social justice, having studied at Kings College (Western University) and University of Windsor <e2> Faculty of Law </e2>.
EMPLOYEE_OR_MEMBER_OF(e1,e2)	Mr. <e1> Bhattarai </e1> has three decades of experience in this area having rendered expert advisory services to ADB, MSI, DFID, UNDP, SNV, ILO, <e2> Transparency International </e2> (TI) and FINNIDA on multiple occasions as Team Leader, Lead Researcher and Expert Advisor.
PLACE_OF_BIRTH(e1,e2)	Presently <e1> I </e1> posted in NTPC (maharatan Company) ,U.P. I m settled in Lucknow <e2> u.p </e2>. my native place Distt Auraiya u.p .
DATE_OF_BIRTH(e1,e2)	<e1> Martin Lundström </e1> (born <e2> May 30, 1918 </e2>) is a former Swedish cross-country skier who competed in the late 1940s and early 1950s.
PLACE_OF_RESIDENCE(e1,e2)	He, along with his wife, <e1> Linda </e1> and daughter Keri lived in the suburbs of Houston, <e2> Texas </e2> for approximately 20 years.
EMPLOYEE_OR_MEMBER_OF(e2,e1)	He worked for  <e2> Columbia University </e2> , the University of Chicago, Encyclopædia Britannica, and <e1> Adler </e1>'s own Institute for Philosophical Research.
NATIONALITY(e1,e2)	<e1> George Thurland Prior </e1> FRS (16 December 1862 – 8 March 1936) was a <e2> British </e2> mineralogist.
PLACE_OF_BIRTH(e1,e2)	<e1> He </e1> was born in <e2> Oslo </e2> and grew up in that city as well as Bryne, Montreal and Aukra.
PLACE_OF_RESIDENCE(e1,e2)	<e1> Murphy </e1> lives and works in Poughkeepsie, <e2> New York </e2>.
DATE_OF_BIRTH(e1,e2)	<e1> Trygve Halvdan Lie </e1> ([ˌtɾyɡʋə ˈliː]; <e2> 16 July 1896 </e2> – 30 December 1968) was a Norwegian politician, labour leader, government official and author.
EMPLOYEE_OR_MEMBER_OF(e1,e2)	"<e1> He </e1> is also a Visiting Professor of Philosophy at New York University, Harvard University, and <e2> Rutgers University </e2>, and was awarded the 2014 Rolf Schock Prize ""for his groundbreaking contributions concerning personal identity, regard for future generations, and analysis of the structure of moral theories."""
EMPLOYEE_OR_MEMBER_OF(e1,e2)	"Jungo TV is founded by business and broadcasting leaders: Dr. Mehmet Oz, the Emmy Award winning television personality, renowned cardio-thoracic surgeon and host of the international hit ""The Dr. Oz Show"", Nasser J. Kazeminy Chairman of NJK Holdings, an entrepreneur, business leader and philanthropist, <e1> Sandy Climan </e1>, CEO of <e2> Entertainment Media Ventures </e2> and longtime Hollywood dealmaker, and George Chung, international content expert and entrepreneur and Chief Executive Officer of Jungo TV."
DATE_OF_BIRTH(e1,e2)	<e1> Adam Ant </e1> (born Stuart Leslie Goddard; <e2> 3 November 1954 </e2>) is an English singer and musician.
EMPLOYEE_OR_MEMBER_OF(e1,e2)	<e1> He </e1> also served as the Director for the <e2> Eastside Boys and Girls Club </e2>, working with over 1,000 youths per year.
NATIONALITY(e1,e2)	<e1> Alexander Mikhajlovich Baldin </e1> (<e2> Russian </e2>: Александр Михайлович Балдин) (February 26, 1926, Moscow — April 29, 2001) was a Russian Soviet physicist, expert in the field of physics of elementary particles and high energy physics.
EMPLOYEE_OR_MEMBER_OF(e1,e2)	Previously Mr. <e1> Reyna </e1> has served as the CEO of various trade and professional associations and was nominated by President Bill Clinton and confirmed by the United States Senate on October 22, 1998 to the three-member Farm Credit Administration (<e2> FCA </e2>) Board of Directors, serving as its Chairman and CEO.
NATIONALITY(e2,e1)	"Edwin Collins ""Alabama"" Pitts, Jr. (November 22, 1909 – June 7, 1941) was an  <e2> American </e2>  convicted felon <e1> who </e1> garnered media attention in his attempt to play professional baseball after his release from Sing Sing prison."
EMPLOYEE_OR_MEMBER_OF(e1,e2)	<e1> Serge Malé </e1>, a national of France, is a senior <e2> UN </e2> official working for the Office of the United Nations High Commissioner for Refugees.
PLACE_OF_RESIDENCE(e1,e2)	Presently I have been studying English at Valencia College in Orlando (Florida), and <e1> my </e1> goal is to improve my language skills and expand my career choices since I've moved to the U.S. from <e2> Brazil </e2>.
NATIONALITY(e1,e2)	<e1> Gerald Beresford Whitham </e1> (13 December 1927 – 26 January 2014) was a British–born <e2> American </e2> applied mathematician and the Charles Lee Powell Professor of Applied Mathematics (Emeritus) of Applied & Computational Mathematics at the California Institute of Technology.
PLACE_OF_RESIDENCE(e1,e2)	Vic Roschkov Sr. has two sons: Vic, is also a notable artist living in London, Ontario and <e1> Tom </e1>, a musician who currently lives in <e2> Edmonton </e2>
PLACE_OF_BIRTH(e1,e2)	"<e1> Johannes (""Hans"") Bernardus Everardus Hoogveld </e1> (born May 21, 1947 in Amersfoort, Utrecht) is a former water polo player from The <e2> Netherlands </e2>, who competed in two consecutive Summer Olympics for his native country, starting in 1968."
DATE_OF_BIRTH(e1,e2)	"Yuly Isayevich Aykhenvald, Aikhenvald, or <e1> Eichenwald </e1> (Russian: Ю́лий Иса́евич Айхенва́льд; <e2> 24 January 1872 </e2> – 17 December 1928) was a Russian Jewish literary critic who developed a native brand of Aestheticism and went down in history as ""a Russian version of Walter Pater"" (Vladimir Nabokov's assessment)."
EDUCATED_AT(e1,e2)	<e1> He </e1> graduated from Topeka High School in 1958, from Washburn University with a B.A. in 1961, from the <e2> University of Denver </e2> with a masters degree in psychology, from Atlanta University with a master's degree in social work, from the University of Cincinnati with a master's degree in community planning, and from Brandeis University with a Ph.D. degree in urban policy, where he was assistant dean of students, in 1971.
DATE_OF_BIRTH(e1,e2)	"<e1> Robert ""Bob"" Arum </e1> (born <e2> December 8, 1931 </e2> in New York City) is an American lawyer, boxing promoter and businessman."
