PLACE_OF_RESIDENCE(e1,e2)	<e1> I </e1> then moved to Maryland where I taught for 1 year before moving to <e2> Colorado </e2>.
EDUCATED_AT(e1,e2)	<e1> Michael </e1> is a full-time student in the Honors College at The University of Delaware, <e2> where </e2> he is pursuing a bachelor's degree.
PLACE_OF_RESIDENCE(e1,e2)	<e1> He </e1> was born in Lardal, but later settled in <e2> Førde </e2>.
PLACE_OF_BIRTH(e1,e2)	<e1> Gerald A. Edwards </e1> was born the sixth of seven children in a small town in Roanoke Rapids, <e2> North Carolina </e2> to Roger and Beatrice Edwards.
NATIONALITY(e1,e2)	<e1> Kristian Gerner </e1> ([krɪɧan gɛːɳər], born 1942) is a <e2> Swedish </e2> historian, author, expert on Eastern Europe and Professor of History at Lund University (since 2002).
DATE_OF_BIRTH(e1,e2)	<e1> William Soeryadjaya </e1> (<e2> December 22, 1922 </e2> – April 2, 2010) (Born Tjia Kian Liong), also known as Oom (Uncle) Willem, born in Majalengka, was a Chinese Indonesian businessman who co-founded Astra International, Indonesia's largest conglomerate.
NATIONALITY(e2,e1)	Oleksandr Nad' ( <e2> Ukrainian </e2> : <e1> Олександр Арпадович Надь </e1>, Hungarian: Sándor Árpád Nagy) (born 2 September 1985 in Uzhhorod, Ukrainian SSR, Soviet Union) is a Ukrainian footballer of Hungarian ethnicity who currently plays for NB I club Budapest Honvéd.
EMPLOYEE_OR_MEMBER_OF(e1,e2)	<e1> He </e1> is a member of MIT's <e2> Department of Electrical Engineering and Computer Science </e2> (EECS) and a member of MIT's Computer Science and Artificial Intelligence Laboratory (CSAIL).
DATE_OF_BIRTH(e1,e2)	<e1> Ziad Makhzoumi </e1> (Born in Beirut, Lebanon on <e2> January 20, 1955 </e2>) is a public speaker, coach and business executive currently serving as the Chief Executive Officer of Fakih IVF.
PLACE_OF_RESIDENCE(e1,e2)	In 1956, <e1> he </e1> emigrated from England to <e2> Canada </e2> to work as a miner in the gold mines in the Red Lake, Ontario district.
DATE_OF_BIRTH(e1,e2)	<e1> James Primrose Whyte Jr. </e1> (<e2> August 25, 1921 </e2> – January 7, 2007) was an American attorney and educator.
EMPLOYEE_OR_MEMBER_OF(e1,e2)	<e1> Jim </e1> then resigned from <e2> C&W </e2>, embraced the China challenge and simultaneously founded Realty Advisory Group, Inc., his new platform.
PLACE_OF_BIRTH(e2,e1)	Laura Ashley was born on September 7, 1925 in  <e2> Dolwais </e2> , Merthyr Tydfil, Wales as <e1> Laura Mountney </e1>.
PLACE_OF_BIRTH(e2,e1)	Philippe Contamine, born 7 May 1932 in  <e2> Metz </e2> , is a French historian of the Middle Ages <e1> who </e1> specialises in military history and the history of the nobility.
EDUCATED_AT(e1,e2)	<e1> He </e1> was born and lived in Adana, Adana Vilayet, southern Turkey, until he went away to school in Istanbul, where he studied respectively at Galatasaray High School and <e2> Robert College </e2>.
PLACE_OF_RESIDENCE(e1,e2)	I have always lived in Soeborg, just outside of Copenhagen, my youngest daughter still lives with me, and <e1> we </e1> have moved in, with my girlfriend in <e2> Vanloese </e2> a bit closer to Copenhagen.
NATIONALITY(e1,e2)	"Naziha Salim (Arabic: ن<e1> زيهة سليم </e1>, 1927–15 February 2008) was an <e2> Iraqi </e2> artist and painter, described by the country's president, Jalal Talabani, as ""the first Iraqi woman who anchored the pillars of Iraqi contemporary art."
PLACE_OF_RESIDENCE(e2,e1)	Alvares is married to Claude Alvares, a known environmental activist and the couple lives in  <e2> Parra </e2> , Goa with their three children, Rahul, <e1> Samir </e1> and Milind.
PLACE_OF_BIRTH(e1,e2)	<e1> Hsieh Wang </e1> was born on May 5, 1930 in <e2> Xi'an </e2>, Shaanxi, Republic of China as Chang Chien Wang.
DATE_OF_BIRTH(e1,e2)	<e1> Brooke </e1> Magnanti (born <e2> November 1975 </e2>) is an American-born naturalised British research scientist, blogger, and writer, who, until her identity was revealed in November 2009, was known by the pen name Belle de Jour.
EDUCATED_AT(e1,e2)	<e1> He </e1> received a bachelor's degree from the University of Iowa and a master's degree from <e2> American University </e2>.
EMPLOYEE_OR_MEMBER_OF(e1,e2)	Prior to <e1> I </e1>nformatica, I worked for <e2> TIBCO </e2> as well as Seebeyond Technologies Corporation (Later acquired by Sun Microsystems) in a variety of different roles including Product Lead for Sun Java CAPS, Senior Sales Engineer/Architect and Strategic Business Development for Sun's Healthcare vertical.
PLACE_OF_RESIDENCE(e2,e1)	She moved to the double monastery at  <e2> Ely </e2>  where her sister <e1> Æthelthryth </e1> was abbess and succeeded her when Æthelthryth died in 679.
PLACE_OF_BIRTH(e1,e2)	Oleksandr Nad' (Ukrainian: Олександр Арпадович Надь, Hungarian: <e1> Sándor Árpád Nagy </e1>) (born 2 September 1985 in Uzhhorod, <e2> Ukrainian SSR </e2>, Soviet Union) is a Ukrainian footballer of Hungarian ethnicity who currently plays for NB I club Budapest Honvéd.
EDUCATED_AT(e1,e2)	When I found <e1> myself </e1> downsized in 2010, I decided it was time to combine my photo/video hobby with my technical knowledge, so I enrolled at <e2> Specs Howard School of Media Arts </e2>, where I studied Digital Media Arts (DMA).
NATIONALITY(e1,e2)	Umedzhon Sharipov (Tajik: <e1> Умедҷон Шарипов </e1>, Persian: امیدجان شریپف; born on 4 October 1991) is a <e2> Tajikistani </e2> footballer who last played for FC Istiklol, and the Tajikistan national football team.
PLACE_OF_RESIDENCE(e1,e2)	<e1> I </e1> moved my family to <e2> Las Vegas </e2> 3 years ago to begin our new Allstate Agency here.
PLACE_OF_BIRTH(e2,e1)	"Johannes (""Hans"") Bernardus Everardus Hoogveld (born May 21, 1947 in Amersfoort, Utrecht) is a former water polo player from The  <e2> Netherlands </e2> , who competed in two consecutive Summer Olympics for <e1> his </e1> native country, starting in 1968."
EMPLOYEE_OR_MEMBER_OF(e1,e2)	On <e1> my </e1> return to South Africa in 2003, I joined <e2> ForwardSlash </e2>, an international online gaming company for 4 years where I was Head of Finance, serving on Exco.
PLACE_OF_RESIDENCE(e1,e2)	<e1> He </e1> won recognition for his ministry from 1873 to 1889 in the Kingdom of Hawaiʻi to people with leprosy (also known as Hansen's disease), who were required to live under a government-sanctioned medical quarantine on the island of <e2> Molokaʻi </e2>.
PLACE_OF_RESIDENCE(e1,e2)	<e1> Brightwell </e1> was born in Rawalpindi, British India, but moved to the UK with his family in 1946 and grew up in <e2> Donnington </e2>, Shropshire.
EMPLOYEE_OR_MEMBER_OF(e1,e2)	<e1> Alain Connes </e1> ([alɛ̃ kɔn]; born 1 April 1947) is a French mathematician, currently Professor at the <e2> Collège de France </e2>, IHÉS, The Ohio State University and Vanderbilt University.
NATIONALITY(e1,e2)	<e1> Terry Semel </e1> (born February 24, 1943) is an <e2> American </e2> corporate executive who was the chairman and CEO of Yahoo! Incorporated.
EMPLOYEE_OR_MEMBER_OF(e1,e2)	"He is a professor at the Department of Chemistry and Biochemistry, University of California, San Diegoand was awarded the 2008 Nobel Prize in chemistry ""for his discovery and development of the green fluorescent protein (GFP) with two other chemists: Martin Chalfie of Columbia University and <e1> Osamu Shimomura </e1> of Boston University and <e2> Marine Biological Laboratory </e2>."
PLACE_OF_RESIDENCE(e1,e2)	<e1> Dr. </e1> Vincent Guido was born and raised in the suburbs of Chicago, and moved to Indiana where he now lives in <e2> West Lafayette </e2> with his wife Sherri.
EMPLOYEE_OR_MEMBER_OF(e1,e2)	<e1> I </e1> resigned from <e2> NIH </e2> in August 2013 and am spending most of my time these days building a website that allows people to acquire many of the goods and services they need for pennies on the dollar.
EMPLOYEE_OR_MEMBER_OF(e2,e1)	" <e2> Jungo TV </e2>  is founded by business and broadcasting leaders: Dr. <e1> Mehmet Oz </e1>, the Emmy Award winning television personality, renowned cardio-thoracic surgeon and host of the international hit ""The Dr. Oz Show"", Nasser J. Kazeminy Chairman of NJK Holdings, an entrepreneur, business leader and philanthropist, Sandy Climan, CEO of Entertainment Media Ventures and longtime Hollywood dealmaker, and George Chung, international content expert and entrepreneur and Chief Executive Officer of Jungo TV."
EMPLOYEE_OR_MEMBER_OF(e1,e2)	Inspired by John von Neumann's seminal First Draft of a Report on the EDVAC, the machine was constructed by <e1> Maurice Wilkes </e1> and his team at the <e2> University of Cambridge Mathematical Laboratory </e2> in England.
EMPLOYEE_OR_MEMBER_OF(e1,e2)	Teodor Shanin OBE, born 1930 in Vilnius, Lithuania (then in possession of Polish Republic) is a British sociologist <e1> who </e1> was for many years a Professor of Sociology at the <e2> University of Manchester </e2>.
PLACE_OF_RESIDENCE(e1,e2)	He lived with his wife, <e1> Edna </e1>, in Hazlet and <e2> Keansburg </e2> before his incarceration.
EMPLOYEE_OR_MEMBER_OF(e1,e2)	<e1> Michael </e1> co-founded and served on the board of directors for Address.com, a leading free email and Internet access service <e2> which </e2> reached more than 3.5 million users (acquired by WhitePages).
PLACE_OF_RESIDENCE(e1,e2)	Because his father was employed by the United States Army, <e1> Frank </e1> lived in Japan, Nevada, California, New York, Texas, North Carolina, and <e2> Hawaii </e2> during his childhood.
EMPLOYEE_OR_MEMBER_OF(e1,e2)	<e1> Dwyer </e1>, who has produced the movement's longest-running e-bulletin, has been appointed as the Telecom Director, Asia Pacific Region <e2> Union Network International </e2>.
NATIONALITY(e1,e2)	<e1> Ivan Rakitić </e1> (born 10 March 1988) is a <e2> Croatian </e2> professional footballer who plays as a central or attacking midfielder for Spanish club FC Barcelona and the Croatia national team.
EDUCATED_AT(e1,e2)	<e1> He </e1> graduated from <e2> Canton High School </e2> in 1952, then attended Northern Arizona University, Flagstaff, two years on an athletic scholarship.
PLACE_OF_RESIDENCE(e1,e2)	<e1> We </e1> moved here from <e2> St. Louis </e2>, Missouri where we had lived our whole lives.
DATE_OF_BIRTH(e1,e2)	Marios Garoyian (Greek: <e1> Μάριος Καρογιάν </e1>; Armenian: Մարիոս Կարոյեան; born <e2> 31 May 1961 </e2>) is a Cypriot-Armenian politician.
EMPLOYEE_OR_MEMBER_OF(e1,e2)	<e1> I </e1> later joined Pickles Auctions <e2> where </e2> I stayed for 17 years, starting with them when they had only two staff members.
EDUCATED_AT(e1,e2)	An alumnus of Indiana University, <e1> Ferguson </e1> also holds an MBA from the <e2> University of Chicago Graduate School of Business </e2> and a law degree from Northwestern University School of Law.
EDUCATED_AT(e1,e2)	<e1> I </e1> am a student at <e2> Albion College </e2> who is pursuing my B.A. in Mass Media Communication Studies.
EMPLOYEE_OR_MEMBER_OF(e2,e1)	Appointed by Asa Gray as assistant in the Gray Herbarium of  <e2> Harvard University </e2>  in 1873, he later became its curator, a position he maintained <e1> until </e1> his death.
EMPLOYEE_OR_MEMBER_OF(e1,e2)	Before Oracle, <e1> Abbie </e1> led customer success and sales teams at <e2> Opower </e2>, a clean tech software company, where she saw the company through IPO and acquisition.
DATE_OF_BIRTH(e1,e2)	<e1> Riley Paulette Vodicka </e1> was born <e2> May 28, 1997 </e2> in Orange County California.
PLACE_OF_RESIDENCE(e1,e2)	<e1> Nicole Shiner </e1> grew up in <e2> Harrisburg </e2>, PA where she fell in love with all things film via her love for acting.
PLACE_OF_RESIDENCE(e1,e2)	<e1> She </e1> became an attendant of Queen Henrietta Maria and travelled with her into exile in <e2> France </e2>, living for a time at the court of the young King Louis XIV.
NATIONALITY(e1,e2)	<e1> Edward John Chalmers Morton </e1> (1856 – 3 October 1902), known as E. J. C. Morton, was a <e2> British </e2> barrister and Liberal Party politician who sat in the House of Commons as a Member of Parliament (MP) for Devonport from 1892 until his death.
DATE_OF_BIRTH(e2,e1)	Diane Setterfield (born  <e2> 22 August 1964 </e2> ) is a British author <e1> whose </e1> 2006 debut novel, The Thirteenth Tale, became a ''New York Times'' No. 1 best-seller.
PLACE_OF_BIRTH(e1,e2)	<e1> Hans </e1> Wouda (born 7 April 1941 in Amsterdam, North Holland) is a former water polo player from the <e2> Netherlands </e2>, who competed in the 1968 and 1972 Summer Olympics for his native country.
EDUCATED_AT(e1,e2)	In the 1940s, <e1> she </e1> graduated from the <e2> Baghdad Fine Arts Institution </e2> and continued her education in Paris.
PLACE_OF_BIRTH(e1,e2)	Born November 10, 1891, in t<e1> he </e1> Italian town of Termini Imerese, Palermo, <e2> Sicily </e2>, he first worked for General Electric (GE) in New York.
EMPLOYEE_OR_MEMBER_OF(e1,e2)	<e1> She </e1> worked at <e2> Microsoft </e2>, where she was project manager for Microsoft Bob, Microsoft Encarta and Expedia.
DATE_OF_BIRTH(e1,e2)	<e1> Kenneth Andrew Jonas Davidson </e1> was born <e2> May 7, 1951 </e2> in Winnipeg the son of Víglundur Franklin Davidsson - W. F. (Bill) Davidson and Thorbjörg (Bobbi) Davidson (nee Solmundson).
EMPLOYEE_OR_MEMBER_OF(e1,e2)	After graduating with a Bachelor of Arts in 1892, <e1> Parks </e1> joined the University of Toronto's staff, <e2> where </e2> he taught geology, paleontology, and mineralogy.
EDUCATED_AT(e1,e2)	Mr. <e1> Dugan </e1> served in the US Navy during World War II as a Chief Petty Officer aboard the USS Memphis in the Southern Atlantic Theater and following the war attended <e2> Villanova University </e2>, graduating with a BS Degree in Economics in 1950.
EMPLOYEE_OR_MEMBER_OF(e1,e2)	"<e1> Annan </e1> quit after becoming frustrated with the <e2> UN </e2>'s lack of progress with regard to conflict resolution, stating that ""when the Syrian people desperately need action, there continues to be finger-pointing and name-calling in the Security Council""."
DATE_OF_BIRTH(e1,e2)	"<e1> James Joseph ""Jimmy"" Chamberlin </e1> (born <e2> June 10, 1964 </e2>) is an American drummer and record producer."
EMPLOYEE_OR_MEMBER_OF(e2,e1)	 <e2> Harvard </e2>  mathematician <e1> Arthur Jaffe </e1> was the first president of CMI.
NATIONALITY(e1,e2)	Melinda Ann Gates (née <e1> French </e1>; born August 15, 1964) is an <e2> American </e2> businesswoman and philanthropist.
DATE_OF_BIRTH(e1,e2)	<e1> Allan Franklin Larsen </e1> (<e2> April 4, 1919 </e2> – March 2, 2005) was a Republican politician from eastern Idaho.
PLACE_OF_RESIDENCE(e1,e2)	Jeremiah Sullivan's father, <e1> Thomas Littleton Sullivan </e1>, was the son of an Irish barrister and emigrated from Charleville, County Cork, Ireland, in 1791 to Augusta County, <e2> Virginia </e2>.
EMPLOYEE_OR_MEMBER_OF(e2,e1)	Bethesda Game Studios Dallas LLC (formerly  <e2> Escalation Studios </e2> ) is an American video game developer based in Dallas, Texas, founded in 2007 by ex-Ritual Entertainment employees Tom Mustaine and <e1> Marc Tardif </e1>.
EMPLOYEE_OR_MEMBER_OF(e1,e2)	Daniel Ellsberg (born April 7, 1931) is an activist and former United States military analyst <e1> who </e1>, while employed by the <e2> RAND Corporation </e2>, precipitated a national political controversy in 1971 when he released the Pentagon Papers, a top-secret Pentagon study of U.S. government decision-making in relation to the Vietnam War, to The New York Times and other newspapers.
PLACE_OF_RESIDENCE(e1,e2)	[citation needed] <e1> He </e1> emigrated to <e2> New Zealand </e2> as a young man, and, two years later (in 1882), he relocated to Sydney, where he found employment at the local branch of George Robertson and Company, booksellers of Melbourne.
DATE_OF_BIRTH(e1,e2)	<e1> Laura Ashley </e1> was born on <e2> September 7, 1925 </e2> in Dolwais, Merthyr Tydfil, Wales as Laura Mountney.
EMPLOYEE_OR_MEMBER_OF(e2,e1)	She was the first female president of King County’s United Way, the first woman to chair the national United Way’s executive committee where she served most notably with  <e2> IBM </e2> 's CEO, <e1> John Opel </e1>, and the first woman on the First Interstate Bank of Washington's board of directors.
EMPLOYEE_OR_MEMBER_OF(e1,e2)	<e1> She </e1> worked for many years as a curator for museums (Kunsthistorisches Museum, Vienna, and the National Gallery of Art, Washington) and as an economist for international organizations (<e2> UNESCO </e2>, European Union, Inter-American Development Bank, and the World Bank).
PLACE_OF_RESIDENCE(e2,e1)	Saint Nectan, sometimes styled Saint Nectan of Hartland, was a 5th-century holy man who lived in  <e2> Stoke </e2> , Hartland, in the English county of Devon, where the prominent Church of Saint Nectan, Hartland is dedicated to <e1> him </e1>.
PLACE_OF_BIRTH(e1,e2)	Throughout his sporting career, <e1> Negrel </e1> trained full-time for La Rose Boxing and Taekwondo Club in his native <e2> Marseilles </e2>, and also became a full-fledged member of the French taekwondo squad since 1996, under head coach and master Philippe Pinard.
PLACE_OF_RESIDENCE(e2,e1)	Born in Connellsville,  <e2> Pennsylvania </e2> , <e1> Davidson </e1> moved with his family to Beaver County, Pennsylvania.
NATIONALITY(e1,e2)	<e1> Claude Champagne </e1> (27 May 1891 – 21 December 1965) was a <e2> Canadian </e2> composer.
EMPLOYEE_OR_MEMBER_OF(e1,e2)	For most of his life <e1> Baudouin de Courtenay </e1> worked at Imperial Russian universities: Kazan (1874–1883), Dorpat (as Tartu, Estonia was then known) (1883–1893), Kraków (1893–1899) in Austria-Hungary, and <e2> St. Petersburg </e2> (1900–1918), where he was known as Иван Александрович Бодуэн де Куртенэ (Ivan Aleksandrovich Boduen de Kurtene), and in Russia he is recognized as a Russian scientist.
PLACE_OF_BIRTH(e2,e1)	Friedrich Hayek CH ([ˈfʁiːdʁɪç ˈaʊ̯ɡʊst ˈhaɪ̯ɛk]; 8 May 1899 – 23 March 1992), born in  <e2> Austria-Hungary </e2>  as Friedrich August von Hayek and frequently referred to as F. A. Hayek, was an Austrian and British economist and philosopher best known for <e1> his </e1> defense of classical liberalism.
PLACE_OF_RESIDENCE(e1,e2)	<e1> Waldemar Tatarczuk </e1>, born in 1964 in Siemiatycze, Poland, lives and works in <e2> Lublin </e2>, Poland.
DATE_OF_BIRTH(e1,e2)	<e1> Dominic D'Alessandro </e1>, OC (born <e2> January 18, 1947 </e2>) was the President and CEO of Manulife Financial from January 1994, a major Canadian insurance company and financial services provider.
EMPLOYEE_OR_MEMBER_OF(e1,e2)	After graduating with MBA, <e1> she </e1> joined The <e2> Ateliers Ritz-Carlton </e2> as an Assistant General Manager.
NATIONALITY(e1,e2)	"<e1> Roger Bruce Myerson </e1> (born March 29, 1951) is an <e2> American </e2> economist and winner of the Sveriges Riksbank Prize in Economic Sciences in Memory of Alfred Nobel, sometimes referred to as the ""Nobel Prize"" for economics, with Leonid Hurwicz and Eric Maskin for ""having laid the foundations of mechanism design theory."""
EMPLOYEE_OR_MEMBER_OF(e2,e1)	The Company is head-quartered in High Wycombe and operates as a stand-alone business  with a Chief Executive Officer and Board of Directors consisting of an independent Chairman, two Directors each from The Gores Group and Premier Foods, and  <e2> our </e2>  new CEO, <e1> Martyn Wilks </e1>.
DATE_OF_BIRTH(e2,e1)	"Beresford Clive Dunfee ( <e2> 1904 </e2>  – 24 September 1932) was a British racing driver, one of the ""Bentley Boys"" of the 1930s, <e1> who </e1> was killed in a dramatic accident at Brooklands Dunfee was the third of four sons of Colonel Vickers Dunfee and the younger brother of Jack Dunfee, also a motor racer."
NATIONALITY(e1,e2)	Don Hugo O'Donnell, 7th Duke of Tetuan (born September 29, 1948), also known as <e1> Hugo O'Donnell y Duque de Estrada </e1>, is a <e2> Spanish </e2> nobleman.
PLACE_OF_RESIDENCE(e1,e2)	<e1> Watson </e1> is married to Maura Giles-Watson; they live in San Diego, <e2> California </e2>.
NATIONALITY(e1,e2)	<e1> Julian Roth </e1> (September 2, 1902 – December 9, 1992) was an <e2> American </e2> architect.
EDUCATED_AT(e2,e1)	A frequent attendee of the  <e2> Mount Angel Iconography Institute </e2>  where he studied with Charles Rohrbacher, Mary Katsilometes, <e1> Claudia Coos </e1>, and Cathy Sievers; more recently he studied in Cottonwood, Idaho with Father Gianluca Busi from Bologna.
DATE_OF_BIRTH(e1,e2)	Hadrawi (born <e1> Mohamed Ibrahim Warsame </e1> in <e2> 1943 </e2>) (Somali: Maxamed Ibraahim Warsame (Hadraawi), Arabic: محمد ابراهيم وارسام هدراوى) is a prominent Somali poet and songwriter.
EMPLOYEE_OR_MEMBER_OF(e1,e2)	<e1> He </e1> was elected a member of the <e2> Royal Swedish Academy of Engineering Sciences </e2> in 1949, and of the Royal Swedish Academy of Sciences in 1953.
PLACE_OF_BIRTH(e1,e2)	<e1> Evan Thomas </e1> was born on February 17, 1891 in Vancouver, <e2> British Columbia </e2>, Canada as Elystan Owen Evan Thomas.
EMPLOYEE_OR_MEMBER_OF(e1,e2)	<e1> He </e1> is a member of the United States Air Force Association, the United States Air Force Academy Association of Graduates, the <e2> Experimental Aircraft Association </e2>, and the Classic Jet Aircraft Association.
EDUCATED_AT(e1,e2)	From t<e1> he </e1>re, he worked in Kalamazoo at the University of Michigan and Upjohn Pharmaceutical before attending the <e2> University of Detroit Mercy Dental School </e2>.
EDUCATED_AT(e1,e2)	<e1> He </e1> graduated in 1911 from <e2> Krakow University </e2>, and then studied architecture at the Technical University of Lwów.
DATE_OF_BIRTH(e1,e2)	<e1> Roberto Irineu Marinho </e1> (born <e2> 1947 </e2>) is a Brazilian billionaire businessman, the co-owner, chairman and CEO, Grupo Globo.
PLACE_OF_BIRTH(e1,e2)	Julian Nott (born <e1> Julian Franklin Keith Nott </e1>, 23 August 1960 in Marylebone, <e2> London </e2>) is a British film composer, mostly of animated films.
NATIONALITY(e2,e1)	"20th century  <e2> Albanian </e2>  scholar <e1> Nasiruddin Albani </e1> refers to his activism as ""Najdi da'wah."""
EMPLOYEE_OR_MEMBER_OF(e1,e2)	Finally, <e1> Deepak Padmanabhan </e1>, one of the leaders responsible for creating and building the Dubai Internet and Media Cities as TECOM Investments' Chief Strategy and Business Development Officer, joined <e2> EIT </e2> as its Chief Executive Officer.
PLACE_OF_RESIDENCE(e1,e2)	The new owner, <e1> Chris Pieschl </e1>, grew up in Overland Park, <e2> KS </e2> and attended Blue Valley High School.
PLACE_OF_BIRTH(e1,e2)	Dr. <e1> Ernesto Foldats Andins </e1> (1925 – 2003), was born in <e2> Latvia </e2>, as Ernests Foldāts.
PLACE_OF_BIRTH(e1,e2)	Chang Yi (born <e1> Chang Po-shen </e1> on 24 February 1945) is a Hong Kong actor and director originally from <e2> Huizhou </e2>, China.
EMPLOYEE_OR_MEMBER_OF(e1,e2)	<e1> He </e1> worked as a researcher at ATR (Advanced Telecommunications Research institute international, 国際電気通信基礎技術研究所), Japan from 1994–2000, a researcher at Starlab, Brussels from 2000–2001, and associate professor of computer science at <e2> Utah State University </e2> from 2001–2006.
PLACE_OF_RESIDENCE(e1,e2)	Vic Roschkov Sr. has two sons: Vic, is also a notable artist living in London, Ontario and Tom, a musician <e1> who </e1> currently lives in <e2> Edmonton </e2>
PLACE_OF_BIRTH(e1,e2)	<e1> Jonathan </e1> Michie (born 25 March 1957, <e2> London </e2>, England) is a British economist and holds the joint post of Director of the Department for Continuing Education, and President of Kellogg College, University of Oxford, where he is Professor of Innovation & Knowledge Exchange.
PLACE_OF_RESIDENCE(e1,e2)	After completing his undergraduate studies at the University of Idaho in 1993, <e1> Dr. </e1> Berard moved to Michigan to earn his Masters Degree in Physiology <e2> from </e2> Eastern Michigan University.
DATE_OF_BIRTH(e1,e2)	<e1> Matt Kohn </e1> (born <e2> September 27, 1981 </e2>) is a former American football quarterback who played two seasons in the Arena Football League with the Nashville Kats and Kansas City Brigade.
NATIONALITY(e1,e2)	<e1> Chou Wen-chung </e1> (Chinese: 周 文 中; pinyin: Zhōu Wénzhōng; born June 29, 1923 in Yantai (Chefoo), Shandong, China) is a Chinese <e2> American </e2> composer of contemporary classical music.
PLACE_OF_BIRTH(e1,e2)	<e1> I </e1> was born in Venezuela, <e2> Caracas </e2> and lived there until I was 7 years old.
EMPLOYEE_OR_MEMBER_OF(e2,e1)	 <e2> Liverpool </e2>  established itself as a major force in both English and European football during the 1970s and '80s when <e1> Bill Shankly </e1> and Bob Paisley led the club to 11 League titles and seven European trophies.
NATIONALITY(e1,e2)	<e1> August Becker </e1> (c. 1810–1875) was a <e2> German </e2> political activist, politician, and journalist.
PLACE_OF_RESIDENCE(e2,e1)	Nicole Shiner grew up in Harrisburg,  <e2> PA </e2>  where she fell in love with all things film <e1> via </e1> her love for acting.
PLACE_OF_RESIDENCE(e1,e2)	<e1> Khatib </e1> moved to Michigan from California in 2000, and immediately began serving as Editor-in-Chief of the Arab <e2> America </e2>n Journal, where she encountered a need for journaling the experience of growing up Arab in America.
PLACE_OF_BIRTH(e1,e2)	<e1> Marie Helvin </e1> (born August 13, 1952, Tokyo, <e2> Japan </e2>) is a British-based American fashion model, who worked extensively with David Bailey—to whom she was married between 1975 and 1985.
EMPLOYEE_OR_MEMBER_OF(e1,e2)	After leaving t<e1> he </e1> <e2> UN </e2>, he worked the world over for the World Health Organization.
PLACE_OF_RESIDENCE(e1,e2)	<e1> Pengilly </e1> is a resident of <e2> Victor Harbor </e2>, and was formerly the mayor of Kangaroo Island as well as chairman of the SA Country Fire Service Board from 1995 to 2000.
